{
  "artifact": "nhms-frontend-c4-live-evidence",
  "schema_version": "1.0",
  "status": "PASS",
  "generated_at": "2026-09-04T01:02:03Z",
  "started_at": "2026-09-04T01:00:00Z",
  "ended_at": "2026-09-04T01:02:03Z",
  "origins": {
    "frontend": "https://test.nwm.ac.cn",
    "api": "https://test.nwm.ac.cn"
  },
  "requested_pins": {
    "basin_id": "basins_qhh",
    "river_segment_id": "basins_qhh_shud_reach_000001"
  },
  "gfs": {
    "source_id": "GFS",
    "basin_id": "basins_qhh",
    "basin_version_id": "bv-2026-09",
    "river_network_version_id": "rn-2026-09",
    "run_id": "qhh_20260904_gfs",
    "model_id": "shud-gfs",
    "cycle_time": "2026-09-04T00:00:00.000Z",
    "scenario": "forecast_gfs_deterministic"
  },
  "ifs": {
    "source_id": "IFS",
    "basin_id": "basins_qhh",
    "basin_version_id": "bv-2026-09",
    "river_network_version_id": "rn-2026-09",
    "run_id": "qhh_20260904_ifs",
    "model_id": "shud-ifs",
    "cycle_time": "2026-09-04T06:00:00.000Z",
    "scenario": "forecast_ifs_deterministic"
  },
  "home": {
    "path": "/",
    "map_surface_visible": true,
    "runtime_config_status": 200,
    "runtime_service_role": "display_readonly",
    "current_read_observed": true,
    "current_read_path": "/api/v1/basins"
  },
  "ops": {
    "gfs": {
      "source_id": "GFS",
      "path": "/ops",
      "heading_observed": true,
      "permission_denied": false,
      "runtime_unavailable": false,
      "status_status": 200,
      "stages_status": 200,
      "jobs_status": 200,
      "job_id": "job-gfs-001",
      "logs_status": 200,
      "role_selector_count": 0,
      "retry_cancel_control_count": 0,
      "slurm_request_count": 0,
      "non_get_control_count": 0,
      "queue_readonly_visible": true,
      "operator_recovery_visible": true
    },
    "ifs": {
      "source_id": "IFS",
      "path": "/ops",
      "heading_observed": true,
      "permission_denied": false,
      "runtime_unavailable": false,
      "status_status": 200,
      "stages_status": 200,
      "jobs_status": 200,
      "job_id": "job-ifs-001",
      "logs_status": 200,
      "role_selector_count": 0,
      "retry_cancel_control_count": 0,
      "slurm_request_count": 0,
      "non_get_control_count": 0,
      "queue_readonly_visible": true,
      "operator_recovery_visible": true
    }
  },
  "source_switch": {
    "both_sources_completed": true,
    "identities_distinct_or_source_bound": true
  },
  "no_control": {
    "slurm_request_count": 0,
    "non_get_control_count": 0
  },
  "failure": null
}
